id,title,overview,rating,release_date,genres,poster_path
1011985,Kung Fu Panda 4,"Po is gearing up to become the spiritual leader of his Valley of Peace, but also needs someone to take his place as Dragon Warrior. As such, he will train a new kung fu practitioner for the spot and will encounter a villain called the Chameleon who conjures villains from the past.",7.005,2024-03-02,"['Action', 'Adventure', 'Animation', 'Comedy', 'Family', 'Fantasy']",/kDp1vUBnMpe8ak4rjgl3cLELqjU.jpg
1197306,A Working Man,"Levon Cade left behind a decorated military career in the black ops to live a simple life working construction. But when his boss's daughter, who is like family to him, is taken by human traffickers, his search to bring her home uncovers a world of corruption far greater than he ever could have imagined.",6.698,2025-03-26,"['Action', 'Crime', 'Thriller']",/6FRFIogh3zFnVWn7Z6zcYnIbRcX.jpg
185664,Nun in Rope Hell,A woman gets caught by the wife of her lover which results in a stabbing. Feeling guilty she runs away and joins a nunnery. But she soon discovers that several nuns and a well known author have turned the place into their own personal S&M playground.,6.3,1984-05-25,"['Drama', 'Horror']",/wne8L5rLN4ZBOSsIt8uh6t8eyqY.jpg
807,Se7en,"Two homicide detectives are on a desperate hunt for a serial killer whose crimes are based on the ""seven deadly sins"" in this dark and haunting film that takes viewers from the tortured remains of one victim to the next. The seasoned Det. Somerset researches each sin in an effort to get inside the killer's mind, while his novice partner, Mills, scoffs at his efforts to unravel the case.",8.382,1995-09-22,"['Crime', 'Mystery', 'Thriller']",/191nKfP0ehp3uIvWqgPbFmI4lv9.jpg
578,Jaws,"When the seaside community of Amity finds itself under attack by a dangerous great white shark, the town's chief of police, a young marine biologist, and a grizzled shark hunter embark on a desperate quest to kill the beast before it strikes again.",7.683,1975-06-20,"['Horror', 'Thriller', 'Adventure']",/lxM6kqilAdpdhqUl2biYp5frUxE.jpg
11036,The Notebook,"An epic love story centered around an older man who reads aloud to a woman with Alzheimer's. From a faded notebook, the old man's words bring to life the story about a couple who is separated by World War II, and is then passionately reunited, seven years later, after they have taken different paths.",7.888,2004-06-25,"['Romance', 'Drama']",/rNzQyW4f8B8cQeg7Dgj3n6eT5k9.jpg
1084187,Pretty Lethal,A troupe of ballerinas find themselves fighting for survival as they attempt to escape from a remote inn after their bus breaks down on the way to a dance competition.,6.766,2026-03-13,"['Music', 'Thriller', 'Action', 'Horror']",/znTPnXCK3lEQJgqXCvP7e5FUz6f.jpg
424,Schindler's List,The true story of how businessman Oskar Schindler saved over a thousand Jewish lives from the Nazis while they worked as slaves in his factory during World War II.,8.57,1993-12-15,"['Drama', 'History', 'War']",/sF1U4EUQS8YHUYjNl3pMGNIQyr0.jpg
1621114,Sleeping Beauty Next Door,"Sydney's rare condition makes her collapse whenever emotions run high-especially in love. When her charming new neighbor Taylor steals her heart, she must fight to stay awake long enough to turn her dream romance into reality.",9.667,2026-01-16,"['Comedy', 'Drama', 'Romance']",/fpjjF8rBI071HMZfLYXdoQHYxYk.jpg
680493,Return to Silent Hill,"When James receives a mysterious letter from his lost love Mary, he is drawn to Silent Hill—a once-familiar town now consumed by darkness. As he searches for her, James faces monstrous creatures and unravels a terrifying truth that will push him to the edge of his sanity.",5.388,2026-01-21,"['Mystery', 'Drama', 'Horror']",/mdw7bSnE11WpwWf3ViXtnavuqiT.jpg
424,Schindler's List,The true story of how businessman Oskar Schindler saved over a thousand Jewish lives from the Nazis while they worked as slaves in his factory during World War II.,8.57,1993-12-15,"['Drama', 'History', 'War']",/sF1U4EUQS8YHUYjNl3pMGNIQyr0.jpg
1621114,Sleeping Beauty Next Door,"Sydney's rare condition makes her collapse whenever emotions run high-especially in love. When her charming new neighbor Taylor steals her heart, she must fight to stay awake long enough to turn her dream romance into reality.",9.667,2026-01-16,"['Comedy', 'Drama', 'Romance']",/fpjjF8rBI071HMZfLYXdoQHYxYk.jpg
680493,Return to Silent Hill,"When James receives a mysterious letter from his lost love Mary, he is drawn to Silent Hill—a once-familiar town now consumed by darkness. As he searches for her, James faces monstrous creatures and unravels a terrifying truth that will push him to the edge of his sanity.",5.388,2026-01-21,"['Mystery', 'Drama', 'Horror']",/mdw7bSnE11WpwWf3ViXtnavuqiT.jpg
106,Predator,A team of elite commandos on a secret mission in a Central American jungle come to find themselves hunted by an extraterrestrial warrior.,7.563,1987-06-12,"['Science Fiction', 'Action', 'Adventure', 'Thriller']",/aN3cdjIK70KGmD84et8MMblU87Q.jpg
10681,WALL·E,"After hundreds of years doing what he was built for, WALL•E— a robot designed to clean up the earth—discovers a new purpose in life when he meets a sleek search robot named EVE. EVE comes to realize that WALL•E has inadvertently stumbled upon the key to the planet's future, and races back to space to report to the humans. Meanwhile, WALL•E chases EVE across the galaxy and sets into motion one of the most imaginative adventures ever brought to the big screen.",8.114,2008-06-26,"['Animation', 'Family', 'Science Fiction']",/hbhFnRzzg6ZDmm8YAmxBnQpQIPh.jpg
76600,Avatar: The Way of Water,"Set more than a decade after the events of the first film, learn the story of the Sully family (Jake, Neytiri, and their kids), the trouble that follows them, the lengths they go to keep each other safe, the battles they fight to stay alive, and the tragedies they endure.",7.593,2022-12-14,"['Action', 'Adventure', 'Science Fiction']",/t6HIqrRAclMCA60NsSmeqe9RmNV.jpg
244786,Whiplash,"Under the direction of a ruthless instructor, a talented young drummer begins to pursue perfection at any cost, even his humanity.",8.375,2014-10-10,"['Drama', 'Music', 'Thriller']",/7fn624j5lj3xTme2SgiLCeuedmO.jpg
150540,Inside Out,"When 11-year-old Riley moves to a new city, her Emotions team up to help her through the transition. Joy, Fear, Anger, Disgust and Sadness work together, but when Joy and Sadness get lost, they must journey through unfamiliar places to get back home.",7.909,2015-06-17,"['Animation', 'Family', 'Adventure', 'Drama', 'Comedy']",/2H1TmgdfNtsKlU9jKdeNyYL5y8T.jpg
405871,On the Beach,"In a summer in Shonan village, Sumiko is the daughter of an important upper-class Shikishima family, she loves to paint pictures, is going through a cooling-off of an arranged marriage that did not work out. However, she feels attraction for Nishina a rough and obscene man ...  On the other hand, the younger sister, Naomi Sumiko is envious of her sister for her beauty. Naomi feels ugly since all men seem to like Sumiko. Both sisters then become embroiled in a major problem in discovering the real intentions of Nishina, a man who hides behind a mask to rape women.",5.6,1985-08-24,['Drama'],/ksl1d50FUHaqNuNnmHSNdPrYyYl.jpg
1196067,Worldbreaker,"Five years ago, a tear in the fabric of reality brought creatures to our world from an alternate dimension bent on our destruction. A father hides his daughter on an island to keep her safe while he prepares her for survival and the battles to come. But when the world is about to break, no place is safe.",6.066,2025-10-30,"['Action', 'Horror', 'Science Fiction']",/ahj1JU8r0uJv7QII5Uj7tKzbEsC.jpg
1930,The Amazing Spider-Man,"Peter Parker is an outcast high schooler abandoned by his parents as a boy, leaving him to be raised by his Uncle Ben and Aunt May. Like most teenagers, Peter is trying to figure out who he is and how he got to be the person he is today. As Peter discovers a mysterious briefcase that belonged to his father, he begins a quest to understand his parents' disappearance – leading him directly to Oscorp and the lab of Dr. Curt Connors, his father's former partner. As Spider-Man is set on a collision course with Connors' alter ego, The Lizard, Peter will make life-altering choices to use his powers and shape his destiny to become a hero.",6.739,2012-06-23,"['Action', 'Adventure', 'Science Fiction']",/jexoNYnPd6vVrmygwF6QZmWPFdu.jpg
1706197,Scandal Queen,"An erotic thriller about Mara, a woman who seduces celebrities and influencers to secretly film and blackmail them for money. But when love enters the picture, her dangerous scheme begins to fall apart.",7.5,2026-06-05,['Drama'],/45A4e9Z7yA2zvFJH5DDlr7aBQlm.jpg
533533,TRON: Ares,"A highly sophisticated Program called Ares is sent from the digital world into the real world on a dangerous mission, marking humankind's first encounter with A.I. beings.",6.497,2025-10-08,"['Science Fiction', 'Adventure', 'Action']",/chpWmskl3aKm1aTZqUHRCtviwPy.jpg
11,Star Wars,Princess Leia is captured and held hostage by the evil Imperial forces in their effort to take over the galactic Empire. Venturesome Luke Skywalker and dashing captain Han Solo team together with the loveable robot duo R2-D2 and C-3PO to rescue the beautiful princess and restore peace and justice in the Empire.,8.206,1977-05-25,"['Adventure', 'Action', 'Science Fiction']",/6FfCtAuVAW8XJjZ7eWeLibRLWTw.jpg
1726,Iron Man,"After being held captive in an Afghan cave, billionaire engineer Tony Stark creates a unique weaponized suit of armor to fight evil.",7.662,2008-04-30,"['Action', 'Science Fiction', 'Adventure']",/78lPtwv72eTNqFW9COBYI0dWDJa.jpg
796,Cruel Intentions,"Slaking a thirst for dangerous games, Kathryn challenges her stepbrother, Sebastian, to deflower their headmaster's daughter before the summer ends. If he succeeds, the prize is the chance to bed Kathryn. But if he loses, Kathryn will claim his most prized possession.",6.816,1999-03-05,"['Drama', 'Romance']",/76cCsRtQ5MJBAqoigojXsLXLJwh.jpg
4232,Scream,"A year after the murder of her mother, a teenage girl is terrorized by a masked killer who targets her and her friends by using scary movies as part of a deadly game.",7.431,1996-12-20,"['Crime', 'Horror', 'Mystery']",/lr9ZIrmuwVmZhpZuTCW8D9g0ZJe.jpg
37165,The Truman Show,"In a picture-perfect seaside town, an insurance salesman begins to realize that his entire existence may be staged and observed by a vast unseen audience as part of a long-running real-time reality TV show.",8.154,1998-06-04,"['Comedy', 'Drama']",/vuza0WqY239yBXOadKlGwJsZJFE.jpg
1202033,Enola Holmes 3,"Adventure follows detective Enola Holmes to Malta, where her plans to tie the knot unravel when Sherlock's disappearance plunges her into a perilous case.",0.0,2026-07-01,"['Adventure', 'Mystery', 'Crime']",/7kRYHH9H9PjBFwz1FprbHB2AAjI.jpg
256835,Toy Story That Time Forgot,"During a post-Christmas play date, the gang find themselves in uncharted territory when the coolest set of action figures ever turn out to be dangerously delusional. It's all up to Trixie, the triceratops, if the gang hopes to return to Bonnie's room in this Toy Story That Time Forgot.",7.1,2014-12-02,"['Animation', 'Family', 'Adventure', 'Comedy']",/kVOaFo8RaYQceHfTqbZGmV9R80q.jpg
9806,The Incredibles,"Bob Parr has given up his superhero days to log in time as an insurance adjuster and raise his three children with his formerly heroic wife in suburbia. But when he receives a mysterious assignment, it's time to get back into costume.",7.726,2004-10-27,"['Action', 'Adventure', 'Animation', 'Family']",/2LqaLgk4Z226KkgPJuiOQ58wvrm.jpg
1372,Blood Diamond,"An ex-mercenary turned smuggler. A Mende fisherman. Amid the explosive civil war overtaking 1999 Sierra Leone, these men join for two desperate missions: recovering a rare pink diamond of immense value and rescuing the fisherman's son, conscripted as a child soldier into the brutal rebel forces ripping a swath of torture and bloodshed countrywide.",7.561,2006-12-08,"['Drama', 'Thriller', 'Action']",/tnLxPpajkbVdbQl5B9CuD7sSpz9.jpg
177572,Big Hero 6,"A special bond develops between plus-sized inflatable robot Baymax, and prodigy Hiro Hamada, who team up with a group of friends to form a band of high-tech heroes.",7.725,2014-10-24,"['Adventure', 'Family', 'Animation', 'Action', 'Comedy']",/2mxS4wUimwlLmI1xp6QW6NSU361.jpg
198663,The Maze Runner,"A teenager with no memory of his past finds himself among a group of boys living in a walled enclosure surrounded by a massive, ever-changing maze. As he struggles to adapt to their rules and society, he begins to uncover clues that may lead to escape and the truth behind their confinement.",7.2,2014-09-10,"['Action', 'Mystery', 'Science Fiction', 'Thriller']",/ode14q7WtDugFDp78fo9lCsmay9.jpg
73111,The Revelation of the Pyramids,"For centuries, the Great Pyramids have fascinated Mankind. Patrice Pooyard's The Revelation Of The Pyramids reveals what lies behind the greatest of archaeological mysteries: a message of paramount importance for humanity. From China to Peru, from Egypt to Mexico, through the world's most enigmatic and most beautiful sites, the director has spent 6 years meeting eminent scientific specialists and verifying his discoveries. The result will shake the teaching of history to its very core, and revolutionize Egyptology entirely. A great odyssey along a breathtaking route climaxes in a revelation as unexpected as it is staggering.",6.5,2010-02-10,"['Documentary', 'History', 'Mystery']",/9I2cpFAeN1MlRqtVa3yfIqHpwwS.jpg
58,Pirates of the Caribbean: Dead Man's Chest,"Captain Jack Sparrow’s got a blood debt to pay: he owes his soul to the legendary Davy Jones, ghastly Ruler of the Ocean Depths. To escape eternal servitude aboard the Flying Dutchman, ever-crafty Jack must track down the still-beating heart of Jones. But he won’t do it alone: Will Turner and Elizabeth Swann are drawn back into another one of his perilous quests—assuming they can evade execution for aiding a pirate.",7.382,2006-07-06,"['Adventure', 'Fantasy', 'Action']",/uXEqmloGyP7UXAiphJUu2v2pcuE.jpg
1628367,Kartavya,"With his family's safety at stake and menacing threats closing in, a police officer must decide how far he'll go to uphold his duty.",6.675,2026-05-15,"['Crime', 'Drama', 'Thriller']",/2I689w0K02r5oXawo08W8yNYIzx.jpg
1501018,A Family of Bastards,"After the death of his father, Mohamed discovers the living of a step-brother and a step-sister. Together, they must manage the suspicious bar they inherited of linked to criminality, drug traffic and prostitution.",5.356,2026-06-12,"['Comedy', 'Crime']",/lJRVhYwrJq9IfXOE5FvSxUxXfnf.jpg
991494,The SpongeBob Movie: Search for SquarePants,"Desperate to be a big guy, SpongeBob sets out to prove his bravery to Mr. Krabs by following The Flying Dutchman – a mysterious swashbuckling ghost pirate – on a seafaring adventure that takes him to the deepest depths of the deep sea, where no Sponge has gone before.",6.84,2025-12-16,"['Adventure', 'Animation', 'Comedy', 'Family', 'Fantasy']",/xJnOMMsFASxNiFnG7v3TNIQ3ife.jpg
354912,Coco,"Despite his family’s baffling generations-old ban on music, Miguel dreams of becoming an accomplished musician like his idol, Ernesto de la Cruz. Desperate to prove his talent, Miguel finds himself in the stunning and colorful Land of the Dead following a mysterious chain of events. Along the way, he meets charming trickster Hector, and together, they set off on an extraordinary journey to unlock the real story behind Miguel's family history.",8.198,2017-10-27,"['Family', 'Animation', 'Music', 'Adventure']",/6Ryitt95xrO8KXuqRGm1fUuNwqF.jpg
1129104,Flavia,"The adventures of 11-year-old Flavia de Luce, who is both an amateur detective and a master poisoner. When she discovers a dead body in her family’s decaying British manor house and her father is accused of the murder, Flavia launches her own investigation to uncover family secrets and bring the true murderer to justice.",6.2,2026-04-12,"['Family', 'Adventure', 'Mystery', 'Comedy']",/xwm7TGTmQcM2PkVvMxTjpYYk600.jpg
11986,Betty Blue,A lackadaisical handyman and aspiring novelist tries to support his younger girlfriend as she slowly succumbs to madness.,7.2,1986-04-09,"['Drama', 'Romance']",/dGkxgj2ozlD4yRtsJL35EUXegFv.jpg
1473332,No One Will Hear Your Scream,"While an entire country is focused on the 1990 World Cup in Italy, someone takes advantage of Argentina's matches to commit brutal murders.",5.375,2025-09-05,"['Horror', 'Thriller']",/32xWlHXSCywvHuy20ElcbAbnpRg.jpg
809,Shrek 2,"Happily ever after never seemed so far far away when a trip to meet the in-laws turns into a hilariously twisted adventure for Shrek and Fiona. With the help of ever-faithful Donkey, Shrek takes on the potion-brewing Fairy Godmother, pompous Prince Charming, and infamous ogre-killer Puss In Boots.",7.32,2004-05-19,"['Animation', 'Comedy', 'Family', 'Fantasy', 'Romance']",/2yYP0PQjG8zVqturh1BAqu2Tixl.jpg
640,Catch Me If You Can,"A true story about Frank Abagnale Jr. who, before his 19th birthday, successfully conned millions of dollars worth of checks as a Pan Am pilot, doctor, and legal prosecutor. An FBI agent makes it his mission to put him behind bars. But Frank not only eludes capture, he revels in the pursuit.",7.978,2002-12-16,"['Drama', 'Crime']",/ctjEj2xM32OvBXCq8zAdK3ZrsAj.jpg
1669057,Check-In,"VMX hottest star Aliya Raymundo teams up with sexy siren Anya Austria as two receptionists in a cheap motel. Their quiet routine heats up with the arrival of a mysterious regular guest who begins to stir tension, desire, and conflict in their fragile relationship.",6.333,2026-05-01,['Drama'],/r7tXZoO3rfkOpYQPCXftwugwny9.jpg
912649,Venom: The Last Dance,"Eddie and Venom are on the run. Hunted by both of their worlds and with the net closing in, the duo are forced into a devastating decision that will bring the curtains down on Venom and Eddie's last dance.",6.676,2024-10-22,"['Science Fiction', 'Action', 'Adventure']",/vGXptEdgZIhPg3cGlc7e8sNPC2e.jpg
11649,Masters of the Universe,"When the evil Skeletor finds a mysterious power called the Cosmic Key, he becomes nearly invincible, seizing Castle Grayskull and the surrounding city. The Sorceress is now Skeletor's prisoner and he begins to drain her life-force as he waits for the moon of Eternia to align with the Great Eye of the Universe which will bestow god-like power upon him. However, courageous warrior He-Man locates the locksmith inventor Gwildor, who created the Key and has another version of it. During a battle, one of the Keys is transported to Earth, where it is found by teenagers Julie and Kevin. Now, both He-Man and Skeletor's forces arrive on Earth searching for the potent weapon.",5.821,1987-08-07,"['Action', 'Fantasy', 'Science Fiction']",/gaUecXFd31V68yOTJPJYaB9YhAf.jpg
1514125,Saigon Sunset,A passionate melodrama depicting the most passionate moments of a woman who went on a trip to forget her ex-lover and a man who started his vacation hoping for a coincidence.,6.0,2025-04-30,"['Romance', 'Drama']",/A7yQj3vKBU98PQoZPghCFUDqDnZ.jpg
1408208,Exit 8,"A man trapped in an endless sterile subway passageway sets out to find Exit 8. The rules of his quest are simple: do not overlook anything out of the ordinary. If you discover an anomaly, turn back immediately. If you don’t, carry on. Then leave from Exit 8. But even a single oversight will send him back to the beginning. Will he ever reach his goal and escape this infinite corridor?",6.829,2025-08-28,"['Horror', 'Mystery']",/nQXYTvm6AY4WmtcPskroqC7Skh.jpg
297802,Aquaman,"Half-human, half-Atlantean Arthur Curry is taken on the journey of his lifetime to discover if he is worth of being a king.",6.868,2018-12-07,"['Action', 'Adventure', 'Fantasy']",/ufl63EFcc5XpByEV2Ecdw6WJZAI.jpg
12445,Harry Potter and the Deathly Hallows: Part 2,"Harry, Ron and Hermione continue their quest to vanquish the evil Voldemort once and for all. Just as things begin to look hopeless for the young wizards, Harry discovers a trio of magical objects that endow him with powers to rival Voldemort's formidable skills.",8.079,2011-07-12,"['Adventure', 'Fantasy']",/c54HpQmuwXjHq2C9wmoACjxoom3.jpg
829560,The Next 365 Days,Laura and Massimo's relationship hangs in the balance as they try to overcome trust issues while a tenacious Nacho works to push them apart.,6.374,2022-08-18,"['Romance', 'Drama']",/8AWm7iMcsCI3DdGz4YEJtiMDp8Z.jpg
269149,Zootopia,"Determined to prove herself, Officer Judy Hopps, the first bunny on Zootopia's police force, jumps at the chance to crack her first case - even if it means partnering with scam-artist fox Nick Wilde to solve the mystery.",7.763,2016-02-11,"['Animation', 'Adventure', 'Family', 'Comedy']",/hlK0e0wAQ3VLuJcsfIYPvb4JVud.jpg
1364953,Mārama,"1859. When a young Māori woman is summoned from New Zealand to North Yorkshire, she uncovers her horrific colonial heritage and is compelled to confront and destroy the titled Englishman who devastated her family.",6.605,2026-04-17,"['Horror', 'Drama', 'Mystery']",/tD9yi1i2t6cgXDrqaBRzjUy7bEX.jpg
13,Forrest Gump,"A man with a low IQ has accomplished great things in his life and been present during significant historic events—in each case, far exceeding what anyone imagined he could do. But despite all he has achieved, his one true love eludes him.",8.465,1994-06-23,"['Comedy', 'Drama', 'Romance']",/Cw4hIUIAmSYfK9QfaUW5igp9La.jpg
1312867,Backrider,"A private massage therapist. After a nasty break up with her gaming and crypto addicted boyfriend, she finds comfort in her rich, and seemingly kind client, but finds herself in a passionate and perilous situation.",4.8,2024-08-13,['Drama'],/egnKJLtMuhkinQZsYbDa8DH6bYU.jpg
396535,Train to Busan,"When a zombie virus pushes Korea into a state of emergency, those trapped on an express train to Busan must fight for their own survival.",7.75,2016-07-20,"['Action', 'Horror', 'Thriller']",/vNVFt6dtcqnI7hqa6LFBUibuFiw.jpg
1003596,Avengers: Doomsday,Beloved heroes from three distinct universes are set on a deadly collision course and face an existential threat unlike anything they've ever encountered.,0.0,2026-12-16,"['Science Fiction', 'Action', 'Adventure']",/8HkIe2i4ScpCkcX9SzZ9IPasqWV.jpg
38,Eternal Sunshine of the Spotless Mind,"Joel Barish, heartbroken that his girlfriend underwent a procedure to erase him from her memory, decides to do the same. However, as he watches his memories of her fade away, he realises that he still loves her, and may be too late to correct his mistake.",8.091,2004-03-19,"['Science Fiction', 'Drama', 'Romance']",/5MwkWH9tYHv3mV9OdYTMR5qreIz.jpg
37169,The Human Centipede (First Sequence),"During a stopover in Germany in the middle of a carefree road trip through Europe, two American girls find themselves alone at night when their car breaks down in the woods. Searching for help at a nearby villa, they are wooed into the clutches of a deranged retired surgeon, who has a very disturbed vision.",5.186,2009-10-31,['Horror'],/gMtjxIkEi0hnTV5lPHbgeZ4ZpUZ.jpg
1549519,Sex Trip,"On a final trip after college graduation, five friends go on a hiking trip and discover a mystical cave that unleashes forbidden desires within them, igniting a night of uninhibited passion, partner-swapping, and raw sexual exploration leaving them forever changed.",6.0,2026-02-20,['Drama'],/oVyD6sX6Vr5Ej8X1DLrs12zG40Y.jpg
588228,The Tomorrow War,"The world is stunned when a group of time travelers arrive from the year 2051 to deliver an urgent message: Thirty years in the future, mankind is losing a global war against a deadly alien species. The only hope for survival is for soldiers and civilians from the present to be transported to the future and join the fight. Among those recruited is high school teacher and family man Dan Forester. Determined to save the world for his young daughter, Dan teams up with a brilliant scientist and his estranged father in a desperate quest to rewrite the fate of the planet.",7.504,2021-09-03,"['Action', 'Science Fiction', 'Adventure']",/34nDCQZwaEvsy4CFO5hkGRFDCVU.jpg
272,Batman Begins,"Driven by tragedy, billionaire Bruce Wayne dedicates his life to uncovering and defeating the corruption that plagues his home, Gotham City.  Unable to work within the system, he instead creates a new identity, a symbol of fear for the criminal underworld - The Batman.",7.727,2005-06-10,"['Drama', 'Crime', 'Action']",/sPX89Td70IDDjVr85jdSBb4rWGr.jpg
284054,Black Panther,"King T'Challa returns home to the reclusive, technologically advanced African nation of Wakanda to serve as his country's new leader. However, T'Challa soon finds that he is challenged for the throne by factions within his own country as well as without. Using powers reserved to Wakandan kings, T'Challa assumes the Black Panther mantle to join with ex-girlfriend Nakia, the queen-mother, his princess-kid sister, members of the Dora Milaje (the Wakandan 'special forces') and an American secret agent, to prevent Wakanda from being dragged into a world war.",7.364,2018-02-13,"['Action', 'Adventure', 'Science Fiction']",/uxzzxijgPIY7slzFvMotPv8wjKA.jpg
389,12 Angry Men,"The defense and the prosecution have rested and the jury is filing into the jury room to decide if a young Spanish-American is guilty or innocent of murdering his father. What begins as an open and shut case soon becomes a mini-drama of each of the jurors' prejudices and preconceptions about the trial, the accused, and each other.",8.563,1957-04-10,['Drama'],/zhG3vKWyDRaZYoaww1UVAi29T9h.jpg
