id,title,overview,rating,release_date,genres,poster_path
166428,How to Train Your Dragon: The Hidden World,"As Hiccup fulfills his dream of creating a peaceful dragon utopia, Toothless’ discovery of an untamed, elusive mate draws the Night Fury away. When danger mounts at home and Hiccup’s reign as village chief is tested, both dragon and rider must make impossible decisions to save their kind.",7.753,2019-01-03,"['Animation', 'Family', 'Adventure']",/xvx4Yhf0DVH8G4LzNISpMfFBDy2.jpg
579974,RRR,A fictional history of two legendary revolutionaries' journey away from home before they began fighting for their country in the 1920s.,7.715,2022-03-24,"['Action', 'History', 'Drama']",/u0XUBNQWlOvrh0Gd97ARGpIkL0.jpg
1315303,Primate,"College student Lucy and her friends spend their vacation at her family's home in Hawaii, which includes her pet chimpanzee, Ben. However, when Ben contracts rabies after being bitten by a rabid animal, the group must fight for their lives in order to avoid the now-violent chimp.",6.527,2026-01-01,['Horror'],/rKleYiEj4pFqxedTRWfujLooi84.jpg
1416391,Toaster,Murder and chaos erupt when a miser becomes obsessed with a toaster he gave as a wedding gift.,5.786,2026-04-15,"['Comedy', 'Crime', 'Action']",/8bsa86WKaQ9plaYN7rd9oGwmyVV.jpg
1571594,The Photographer,"Inna, a young post-mortem photographer, arrives at a remote orphanage in northern Spain to capture the final image of Alejandra, a girl found dead under mysterious circumstances. But as her lens lingers on the tragedy, Inna begins to sense a dark presence within the orphanage's walls-an evil that refuses to remain hidden and threatens to make her its next subject.",7.2,2025-10-30,"['Horror', 'Thriller']",/95pZ9yB5SABddzaINITvZd7SvER.jpg
176,Saw,"Two men wake up to find themselves shackled in a grimy, abandoned bathroom. As they struggle to comprehend their predicament, they discover a disturbing tape left behind by the sadistic mastermind known as Jigsaw. With a chilling voice and cryptic instructions, Jigsaw informs them that they must partake in a gruesome game in order to secure their freedom.",7.422,2004-10-01,"['Horror', 'Mystery', 'Crime']",/rLNSOudrayDBo1uqXjrhxcjODIC.jpg
85,Raiders of the Lost Ark,"When Dr. Indiana Jones – the tweed-suited professor who just happens to be a celebrated archaeologist – is hired by the government to locate the legendary Ark of the Covenant, he finds himself up against the entire Nazi regime.",7.924,1981-06-12,"['Adventure', 'Action']",/ceG9VzoRAVGwivFU403Wc3AHRys.jpg
107257,A Perfect Ending,"This intimate drama follows Rebecca, a woman who has kept her sexuality a secret from her friends but chooses to reveal it to a stranger. While Rebecca's revelations may not yield the results she expects, a perfect ending is still in reach.",6.239,2012-06-01,"['Drama', 'Romance']",/mjwWEwE1xdbtFGCOgeXi5jvQnOU.jpg
11544,Lilo & Stitch,"As Stitch, a runaway genetic experiment from a faraway planet, wreaks havoc on the Hawaiian Islands, he becomes the mischievous adopted alien ""puppy"" of an independent little girl named Lilo and learns about loyalty, friendship, and ʻohana, the Hawaiian tradition of family.",7.561,2002-06-21,"['Animation', 'Family', 'Comedy', 'Science Fiction']",/cFuLvQJPoZpuruAtN3rVnMmLIH8.jpg
14324,Virgin Territory,"In Black Death era Tuscany, as in the Decameron, ten young Florentines take refuge from the plague. But instead of telling stories, they have lusty adventures, bawdy exchanges, romance, swordplay, randy nuns, Saracen pirates, and a sexy cow.",5.0,2007-12-17,"['Adventure', 'Action', 'Comedy', 'Romance']",/zofWP7ZKhoVTh2VUltaDo4LRQXc.jpg
56292,Mission: Impossible - Ghost Protocol,"Ethan Hunt and his team are racing against time to track down a dangerous terrorist named Hendricks, who has gained access to Russian nuclear launch codes and is planning a strike on the United States. An attempt to stop him ends in an explosion causing severe destruction to the Kremlin and the IMF to be implicated in the bombing, forcing the President to disavow them. No longer being aided by the government, Ethan and his team chase Hendricks around the globe, although they might still be too late to stop a disaster.",7.114,2011-12-07,"['Action', 'Thriller', 'Adventure']",/eRZTGx7GsiKqPch96k27LK005ZL.jpg
1119878,Ice Road: Vengeance,"Big rig ice road driver Mike McCann travels to Nepal to scatter his late brother’s ashes on Mt. Everest. While on a packed tour bus traversing the deadly 12,000 ft. terrain of the infamous Road to the Sky, McCann and his mountain guide encounter a group of mercenaries and must fight to save themselves, the busload of innocent travelers, and the local villagers’ homeland.",6.243,2025-06-27,"['Action', 'Thriller', 'Drama']",/cQN9rZj06rXMVkk76UF1DfBAico.jpg
950,Ice Age: The Meltdown,"Diego, Manny and Sid return in this sequel to the hit animated movie Ice Age. This time around, the deep freeze is over, and the ice-covered earth is starting to melt, which will destroy the trio's cherished valley. The impending disaster prompts them to reunite and warn all the other beasts about the desperate situation.",6.722,2006-03-29,"['Animation', 'Family', 'Comedy', 'Adventure']",/8vNkkk4erLGDg3UfbmSHsTdSNcY.jpg
482706,Oligosaccharide The Movie,"A truth tale about ""Oligosaccharide"" written by Crocodile Man. One 'Geun-hyeok' and ten 'Mi-jeongs' put on a sexy adult fantasy! Geun-hyeok and Mi-jeong switch bodies after they have intercourse. Mi-jeong asks Geun-hyeok for something as she's about to get married... Mi-jeong is a call girl who seduces Geun-seok. She's actually a killer. What is she? Tae-sik only drinks black coffee and Mi-jeong likes him. Will they come true? Tae-sik is a loser who uses his wife to rip money off of other men. Geun-hyeok loves her. What will happen to them? What if someone is watching me? Mi-jeong asks detective Geun-hyeok for help... ""I have a wife!"" Geun-hyeok drinks with his sexy superior Mi-jeong and thing happen. Mi-jeong and her husband have a pile of debt. Mi-jeong goes to her friend Geun-hyeok who can foresee the future. Geun-hyeok is perfect and Mi-jeong loves her husband but she can't help feeling unsteady. Tae-sik leaves on a suicide journey and meets Mi-jeong. They fall in love...",4.5,2017-06-15,['Drama'],/8hRAm3H3wwBGRBCre6xfQfpwmHj.jpg
1232889,Malta,"Mariana is a systematic girl. She studies English and German at a language school. She works in a call center as many hours as possible and saves everything she earns. To entertain herself a little, she looks for men in bars with whom she only plans to spend one night. Why compromise if she just wants to travel? That is Mariana's plan, to go away and what better than to an island in the Mediterranean. But Gabriel, an unlikely boy who keeps getting into her life with bad jokes and uncomfortable questions, forces her to look at herself and wonder what she wants to run away from.",5.4,2024-03-08,"['Drama', 'Science Fiction']",/64cVvqAGgxlRXRGue6Aw5BPDSRF.jpg
637,Life Is Beautiful,A touching story of an Italian book seller of Jewish ancestry who lives in his own little fairy tale. His creative and happy life would come to an abrupt halt when his entire family is deported to a concentration camp during World War II. While locked up he tries to convince his son that the whole thing is just a game.,8.439,1997-12-20,"['Comedy', 'Drama']",/6tEJnof1DKWPnl5lzkjf0FVv7oB.jpg
242,The Godfather Part III,"In the midst of trying to legitimize his business dealings in 1979 New York and Italy, aging mafia don, Michael Corleone seeks forgiveness for his sins while taking a young protege under his wing.",7.42,1990-12-25,"['Crime', 'Drama', 'Thriller']",/lm3pQ2QoQ16pextRsmnUbG2onES.jpg
616037,Thor: Love and Thunder,"After his retirement is interrupted by Gorr the God Butcher, a galactic killer who seeks the extinction of the gods, Thor Odinson enlists the help of King Valkyrie, Korg, and ex-girlfriend Jane Foster, who now wields Mjolnir as the Mighty Thor. Together they embark upon a harrowing cosmic adventure to uncover the mystery of the God Butcher’s vengeance and stop him before it’s too late.",6.368,2022-07-06,"['Fantasy', 'Action', 'Comedy']",/pIkRyD18kl4FhoCNQuWxWu5cBLM.jpg
713704,Evil Dead Rise,"A reunion between two estranged sisters gets cut short by the rise of flesh-possessing demons, thrusting them into a primal battle for survival as they face the most nightmarish version of family imaginable.",6.934,2023-04-12,"['Horror', 'Thriller']",/5ik4ATKmNtmJU6AYD0bLm56BCVM.jpg
10591,The Girl Next Door,"Exceptionally ambitious high schooler Matthew has aspirations for a career in politics when he falls in love with his gorgeous 19-year-old neighbor, Danielle. But Matthew's bright future is jeopardized when he finds Danielle was once a porn star. As Danielle's past catches up with her, Matthew's love for her forces him to re-evaluate his goals.",6.748,2004-04-09,"['Comedy', 'Romance']",/5mVyFHSY2rSsNgD4NfEwV82HigU.jpg
1072790,Anyone But You,"After an amazing first date, Bea and Ben’s fiery attraction turns ice cold — until they find themselves unexpectedly reunited at a destination wedding in Australia. So they do what any two mature adults would do: pretend to be a couple.",6.767,2023-12-21,"['Romance', 'Comedy']",/5qHoazZiaLe7oFBok7XlUhg96f2.jpg
667538,Transformers: Rise of the Beasts,"When a new threat capable of destroying the entire planet emerges, Optimus Prime and the Autobots must team up with a powerful faction known as the Maximals. With the fate of humanity hanging in the balance, humans Noah and Elena will do whatever it takes to help the Transformers as they engage in the ultimate battle to save Earth.",7.17,2023-06-06,"['Science Fiction', 'Adventure', 'Action']",/gPbM0MK8CP8A174rmUwGsADNYKD.jpg
670,Oldboy,"With no clue how he came to be imprisoned, drugged and tortured for 15 years, a desperate man seeks revenge on his captors.",8.236,2003-11-21,"['Thriller', 'Mystery']",/pWDtjs568ZfOTMbURQBYuT4Qxka.jpg
103,Taxi Driver,"Suffering from insomnia, disturbed loner Travis Bickle takes a job as a New York City cabbie, haunting the streets nightly, growing increasingly detached from reality as he dreams of cleaning up the filthy city.",8.125,1976-02-09,"['Crime', 'Drama']",/ekstpH614fwDX8DUln1a2Opz0N8.jpg
1642859,Iron Maiden: Burning Ambition,"With unprecedented access to the official archives and intimate recollections from the band, both current and past,  Iron Maiden: Burning Ambition invites fans to experience one of the most iconic journeys in music history.  Spanning five decades, this electrifying documentary charts the band’s rise from the pubs of East London to the world’s biggest stadiums. Featuring exclusive interviews with band members and contributors such as Javier Bardem, Lars Ulrich and Chuck D, as well as all-new animated sequences of the band's legendary mascot, Eddie, the film offers a rare and intimate look at Iron Maiden’s uncompromising vision and unwavering connection with their truly global army of fans.",7.278,2026-05-07,"['Documentary', 'Music']",/yZqhFJDenLfgF1VygOOCNmAdS1P.jpg
524047,Greenland,"John Garrity, his estranged wife and their young son embark on a perilous journey to find sanctuary as a planet-killing comet hurtles toward Earth. Amid terrifying accounts of cities getting levelled, the Garritys experience the best and worst in humanity. As the countdown to the global apocalypse approaches zero, their incredible trek culminates in a desperate and last-minute flight to a possible safe haven.",7.128,2020-07-29,"['Thriller', 'Adventure', 'Action', 'Science Fiction']",/bNo2mcvSwIvnx8K6y1euAc1TLVq.jpg
1278162,Panor,"Born during an ancient village ritual, Panor faces isolation as mysterious misfortunes plague those around her. She must uncover the truth behind the dark curse that has haunted her since birth.",6.889,2025-01-16,"['Horror', 'Thriller']",/o3tG02uudhv1YemqPUoC75q3lbr.jpg
18334,Guinea Pig: Devil's Experiment,Masked thugs torture an innocent woman in increasingly brutal ways.,4.784,1985-09-04,['Horror'],/gyloAdASwFB0Ksm9Ky9xHLYsgZk.jpg
458376,Neo Chinpira 2: Zoom Goes the Bullet,"In the sequel to 1990's classic Neo Chinpira, Junko (Sho Aikawa) attempts to take out Kazama and then goes on the run. However, he quickly begins to feel homesick, and returns home to find that almost everything has changed. Noriko is now a bar mama with a lavish lifestyle, Yumeko is nowhere to be found, and his boss (Toru Minegishi) seems to have sinister plans involving Junko and his uncle (Jo Shishido).",0.0,1991-04-12,[],/rNxItOXexbqwpXBSOGbrH6VHsS0.jpg
10020,Beauty and the Beast,"Follow the adventures of Belle, a bright young woman who finds herself in the castle of a prince who's been turned into a mysterious beast. With the help of the castle's enchanted staff, Belle soon learns the most important lesson of all -- that true beauty comes from within.",7.727,1991-10-22,"['Romance', 'Family', 'Animation', 'Fantasy']",/hUJ0UvQ5tgE2Z9WpfuduVSdiCiU.jpg
573435,Bad Boys: Ride or Die,"After their late former Captain is framed, Lowrey and Burnett try to clear his name, only to end up on the run themselves.",7.324,2024-06-05,"['Action', 'Comedy', 'Crime']",/oGythE98MYleE6mZlGs5oBGkux1.jpg
674324,The Banshees of Inisherin,"Two lifelong friends find themselves at an impasse when one abruptly ends their relationship, with alarming consequences for both of them.",7.463,2022-10-20,"['Drama', 'Comedy']",/4yFG6cSPaCaPhyJ1vtGOtMD1lgh.jpg
278927,The Jungle Book,"After a threat from the tiger Shere Khan, Mowgli, a man-cub fostered by wolves, is forced to flee the jungle, and he embarks on a journey of self-discovery with the help of the panther, Bagheera, and the free-spirited bear, Baloo.",6.874,2016-04-07,"['Adventure', 'Family', 'Fantasy']",/2Epx7F9X7DrFptn4seqn4mzBVks.jpg
104894,A Garden Without Birds,"Four friends arrange a kinky sex party at the top of a luxury hotel, where a dominatrix and her gimp await for the guests. Once they start using drugs to spice things up, the party takes a bloody turn.",4.9,1992-12-01,['Horror'],/7BkL7rz9cyVZAlvxKmeMLAnNvd9.jpg
1511417,Bāhubali: The Epic,"When a mysterious child is found by a tribal couple near a roaring waterfall, they raise him as their own. As he grows, Sivudu is drawn to the world beyond the cliffs, where he discovers the ancient kingdom of Mahishmati, ruled by a cruel tyrant, haunted by rebellion, and bound to his past. What begins as a quest for love soon unravels a legacy of betrayal, sacrifice, and a forgotten prince.",6.2,2025-10-29,"['Action', 'Drama']",/z9YIo2qscyaXYgRqIdRJtND3bw8.jpg
28,Apocalypse Now,"At the height of the Vietnam war, Captain Benjamin Willard is sent on a dangerous mission that, officially, ""does not exist, nor will it ever exist."" His goal is to locate - and eliminate - a mysterious Green Beret Colonel named Walter Kurtz, who has been leading his personal army on illegal guerrilla missions into enemy territory.",8.27,1979-05-19,"['Drama', 'War']",/gQB8Y5RCMkv2zwzFHbUJX3kAhvA.jpg
1142921,Tere Ishk Mein,"A psychology student attempts to rehabilitate a volatile young man, before evolving into a doomed romance.",5.588,2025-11-28,"['Romance', 'Drama']",/7FsHlW9z7gDhDE4EXAE2WcXUVQj.jpg
68718,Django Unchained,"With the help of a German bounty hunter, a freed slave sets out to rescue his wife from a brutal Mississippi plantation owner.",8.192,2012-12-25,"['Drama', 'Western']",/7oWY8VDWW7thTzWh3OKYRkWUlD5.jpg
1393326,Ghost in the Cell,"In a notorious prison, an invisible force begins killing inmates brutally, compelling enemy gangs and corrupt guards to work together as they try to survive the mounting bloodshed.",7.962,2026-04-16,"['Horror', 'Comedy']",/gF6Ijrq5bixh4qemCuroRwXtbBc.jpg
1156869,Blaze of Love,Hong Kong movie,0.0,1994-01-01,[],/cSOW4av17KfO9K2CRqKCjMbeoMw.jpg
76726,Chronicle,"Three high school students make an incredible discovery, leading to their developing uncanny powers beyond their understanding. As they learn to control their abilities and use them to their advantage, their lives start to spin out of control, and their darker sides begin to take over.",6.856,2012-02-01,"['Science Fiction', 'Drama', 'Thriller']",/kdyrdFIt29FUmLIKvedAc2j4rpo.jpg
13186,Wrong Turn 2: Dead End,Retired military commander Colonel Dale Murphy hosts the simulated post-apocalyptic reality show where participants are challenged to survive a remote West Virginia wasteland. But the show turns into a nightmarish showdown when each realizes they are being hunted by an inbred family of cannibals determined to make them all dinner!,6.17,2007-08-25,"['Horror', 'Thriller']",/ow3IMhTVLryZuCEoQznVTTmFYuu.jpg
598,City of God,"In the poverty-stricken favelas of Rio de Janeiro in the 1970s, two young men choose different paths. Rocket is a budding photographer who documents the increasing drug-related violence of his neighborhood, while José “Zé” Pequeno is an ambitious drug dealer diving into a dangerous life of crime.",8.429,2002-08-30,"['Drama', 'Crime']",/k7eYdWvhYQyRQoU2TB2A2Xu2TfD.jpg
6479,I Am Legend,"Robert Neville is a scientist who was unable to stop the spread of the terrible virus that was incurable and man-made. Immune, Neville is now the last human survivor in what is left of New York City and perhaps the world. For three years, Neville has faithfully sent out daily radio messages, desperate to find any other survivors who might be out there. But he is not alone.",7.217,2007-12-12,"['Drama', 'Science Fiction', 'Thriller']",/iPDkaSdKk2jRLTM65UOEoKtsIZ8.jpg
353081,Mission: Impossible - Fallout,"When an IMF mission ends badly, the world is faced with dire consequences. As Ethan Hunt takes it upon himself to fulfill his original briefing, the CIA begin to question his loyalty and his motives. The IMF team find themselves in a race against time, hunted by assassins while trying to prevent a global catastrophe.",7.45,2018-07-25,"['Action', 'Adventure']",/AkJQpZp9WoNdj7pLYSj1L0RcMMN.jpg
607,Men in Black,"After a police chase with an otherworldly being, a New York City cop is recruited as an agent in a top-secret organization established to monitor and police alien activity on Earth: the Men in Black. Agent K and new recruit Agent J find themselves in the middle of a deadly plot by an intergalactic terrorist who has arrived on Earth to assassinate two ambassadors from opposing galaxies.",7.224,1997-07-02,"['Action', 'Adventure', 'Comedy', 'Science Fiction']",/uLOmOF5IzWoyrgIF5MfUnh5pa1X.jpg
57158,The Hobbit: The Desolation of Smaug,"The Dwarves, Bilbo and Gandalf have successfully escaped the Misty Mountains, and Bilbo has gained the One Ring. They all continue their journey to get their gold back from the Dragon, Smaug.",7.58,2013-12-11,"['Fantasy', 'Adventure', 'Action']",/xQYiXsheRCDBA39DOrmaw1aSpbk.jpg
436969,The Suicide Squad,"Supervillains Harley Quinn, Bloodsport, Peacemaker and a collection of nutty cons at Belle Reve prison join the super-secret, super-shady Task Force X as they are dropped off at the remote, enemy-infused island of Corto Maltese.",7.458,2021-07-28,"['Action', 'Comedy', 'Adventure']",/q61qEyssk2ku3okWICKArlAdhBn.jpg
345940,The Meg,"A deep sea submersible pilot revisits his past fears in the Mariana Trench, and accidentally unleashes the seventy foot ancestor of the Great White Shark believed to be extinct.",6.247,2018-08-09,"['Action', 'Science Fiction', 'Horror']",/eyWICPcxOuTcDDDbTMOZawoOn8d.jpg
351286,Jurassic World: Fallen Kingdom,"Three years after Jurassic World was destroyed, Isla Nublar now sits abandoned. When the island's dormant volcano begins roaring to life, Owen and Claire mount a campaign to rescue the remaining dinosaurs from this extinction-level event.",6.531,2018-06-06,"['Adventure', 'Science Fiction', 'Thriller']",/x2Us3jR6ToMJjbcPbLimYoxf6xr.jpg
161,Ocean's Eleven,"Less than 24 hours into his parole, charismatic thief Danny Ocean is already rolling out his next plan: In one night, Danny's hand-picked crew of specialists will attempt to steal more than $150 million from three Las Vegas casinos. But to score the cash, Danny risks his chances of reconciling with ex-wife, Tess.",7.461,2001-12-07,"['Thriller', 'Crime']",/hQQCdZrsHtZyR6NbKH2YyCqd2fR.jpg
418577,Quest of the Sex: Rumble in the Women's Empire,"West, her students Suen and Chu have to pass through Women’s Empire and visit the King, Kam. Kam’s sister Ann knew if suck the horny water from West could become powerful. Ann told West try to rape her and put them in the jail. Kam offer to set them free, but West have to marry her. West agrees about that, in fact they want to escape in the mess. When they escape, Ann kidnaps West and sucks her horny water. It makes Ann become powerful, West have sex with Suen, Suen become powerful and fight with Ann. Finally, Suen …",5.5,2003-09-12,['Comedy'],/jGLV5BYPYzRdgjxqznVTRowZxPd.jpg
945961,Alien: Romulus,"While scavenging the deep ends of a derelict space station, a group of young space colonizers come face to face with the most terrifying life form in the universe.",7.162,2024-08-13,"['Horror', 'Science Fiction']",/2uSWRTtCG336nuBiG8jOTEUKSy8.jpg
1241693,Do Deewane Seher Mein,"Two socially awkward millennials in Mumbai find love while struggling with self-acceptance. As they battle insecurities and societal pressure, their journey takes them from city chaos to mountain serenity.",6.357,2026-02-20,"['Romance', 'Drama', 'Comedy']",/p8yPjT9NAH87oD9TedclRaAW7RY.jpg
645710,The Voyeurs,"When Pippa and Thomas move into their dream apartment, they notice that their windows look directly into the apartment opposite – inviting them to witness the volatile relationship of the attractive couple across the street. But what starts as a simple curiosity turns into full-blown obsession with increasingly dangerous consequences.",6.52,2021-08-25,['Thriller'],/8Y4XOIWhpOvSOEn8XrxbkH9yAXO.jpg
1241693,Do Deewane Seher Mein,"Two socially awkward millennials in Mumbai find love while struggling with self-acceptance. As they battle insecurities and societal pressure, their journey takes them from city chaos to mountain serenity.",6.357,2026-02-20,"['Romance', 'Drama', 'Comedy']",/p8yPjT9NAH87oD9TedclRaAW7RY.jpg
645710,The Voyeurs,"When Pippa and Thomas move into their dream apartment, they notice that their windows look directly into the apartment opposite – inviting them to witness the volatile relationship of the attractive couple across the street. But what starts as a simple curiosity turns into full-blown obsession with increasingly dangerous consequences.",6.52,2021-08-25,['Thriller'],/8Y4XOIWhpOvSOEn8XrxbkH9yAXO.jpg
10198,The Princess and the Frog,"A waitress, desperate to fulfill her dreams as a restaurant owner, is set on a journey to turn a frog prince back into a human being, but she has to face the same problem after she kisses him.",7.227,2009-12-08,"['Animation', 'Romance', 'Fantasy', 'Family']",/yprv5PbnEksoVj2v6XEnDBg9joR.jpg
166426,Pirates of the Caribbean: Dead Men Tell No Tales,"Thrust into an all-new adventure, a down-on-his-luck Capt. Jack Sparrow feels the winds of ill-fortune blowing even more strongly when deadly ghost sailors led by his old nemesis, the evil Capt. Salazar, escape from the Devil's Triangle. Jack's only hope of survival lies in seeking out the legendary Trident of Poseidon, but to find it, he must forge an uneasy alliance with a brilliant and beautiful astronomer and a headstrong young man in the British navy.",6.659,2017-05-23,"['Adventure', 'Action', 'Fantasy']",/6lAPOAFYFWIO3SQRemEY2wInQMC.jpg
283995,Guardians of the Galaxy Vol. 2,The Guardians must fight to keep their newfound family together as they unravel the mysteries of Peter Quill's true parentage.,7.61,2017-04-25,"['Science Fiction', 'Adventure', 'Action']",/y4MBh0EjBlMuOzv9axM4qJlmhzz.jpg
76492,Hotel Transylvania,"Welcome to Hotel Transylvania, Dracula's lavish five-stake resort, where monsters and their families can live it up and no humans are allowed. One special weekend, Dracula has invited all his best friends to celebrate his beloved daughter Mavis's 118th birthday. For Dracula catering to all of these legendary monsters is no problem but the party really starts when one ordinary guy stumbles into the hotel and changes everything!",6.965,2012-09-20,"['Animation', 'Comedy', 'Family', 'Fantasy']",/eJGvzGrsfe2sqTUPv5IwLWXjVuR.jpg
184345,A Haunted House 2,"After exorcising the demons of his ex, Malcolm starts afresh with his new girlfriend and her two children. After moving into their dream home, Malcolm is once again plagued by bizarre paranormal events.",6.191,2014-04-17,"['Comedy', 'Horror']",/oV7M00fPXy5P0nbdeMbSUjYv0vx.jpg
1891,The Empire Strikes Back,"The epic saga continues as Luke Skywalker, in hopes of defeating the evil Galactic Empire, learns the ways of the Jedi from aging master Yoda. But Darth Vader is more determined than ever to capture Luke. Meanwhile, rebel leader Princess Leia, cocky Han Solo, Chewbacca, and droids C-3PO and R2-D2 are thrown into various stages of capture, betrayal and despair.",8.392,1980-05-20,"['Adventure', 'Action', 'Science Fiction']",/nNAeTmF4CtdSgMDplXTDPOpYzsX.jpg
696842,Scorsese's GoodFellas,"In this produced by Brett Ratner new retrospective documentary we hear from cast members and additional participants include Harvey Keitel, Leonardo DiCaprio and Terence Winter, creator of Boardwalk Empire and screenwriter of The Wolf of Wall Street. The program gives us thoughts about Scorsese's approach to the material, casting, characters, and performances, costumes and period details, photography, music, and retrospective thoughts about the film. It is filled with memorable stories and observations from a wide array of commentators.",8.3,2015-05-05,['Documentary'],/9CZo35KHJDRbPyN64XsPU1LZxQB.jpg
