id,title,overview,rating,release_date,genres,poster_path
1663082,The Last Supper,"In a deserted house, a mysterious man savors an exquisite menu in the company of an unseen guest. From this eerie dinner table, a succession of terrifying stories is revealed-each probing primal fears of hunger, flesh, and survival.",7.0,2025-10-23,['Horror'],/6rGa9huzhmG1i2iu2Vcyv5HI02t.jpg
18240,The Proposal,"When she learns she's in danger of losing her visa status and being deported, overbearing book editor Margaret Tate forces her put-upon assistant, Andrew Paxton, to marry her.",7.168,2009-06-02,"['Comedy', 'Romance', 'Drama']",/6stnAm1wSek8ZrislwK4xGTyCnt.jpg
3933,Corpse Bride,"In a 19th-century European village, a young man about to be married is whisked away to the underworld and wed to a mysterious corpse bride, while his real bride waits bereft in the land of the living.",7.6,2005-09-12,"['Romance', 'Fantasy', 'Animation']",/3RAoVTxUk1OzZClscAsynuu670p.jpg
1511057,Roommates,"When shy college freshman Devon asks cool-girl Celeste to be her roommate, a blossoming friendship quickly spirals into a war of passive aggression.",6.545,2026-04-13,['Comedy'],/6EuUD71ig2DXtAgoTawXL0L6mhR.jpg
1505183,Village of the Dead,"Four hikers become trapped in a mysterious village after getting lost in a mountain foot market said to be an interdimensional gateway. There, the world turns strange—graveyards with no headstones, grinning bald figures, puppets with no puppeteer, and cult rituals dancing atop corpses. It all leads to one chilling truth: those who are trapped can never leave. The village is preparing a dark ritual to fill the hamlet with the dead. Faced with harrowing choices, can they survive—and make it home alive?",5.333,2025-12-31,"['Adventure', 'Horror', 'Mystery']",/3mU1gWEfT2j3L3MDCPO2GVz20xK.jpg
1511057,Roommates,"When shy college freshman Devon asks cool-girl Celeste to be her roommate, a blossoming friendship quickly spirals into a war of passive aggression.",6.545,2026-04-13,['Comedy'],/6EuUD71ig2DXtAgoTawXL0L6mhR.jpg
447365,Guardians of the Galaxy Vol. 3,"Peter Quill, still reeling from the loss of Gamora, must rally his team around him to defend the universe along with protecting one of their own. A mission that, if not completed successfully, could quite possibly lead to the end of the Guardians as we know them.",7.932,2023-05-03,"['Science Fiction', 'Adventure', 'Action']",/r2J02Z2OpNTctfOSN1Ydgii51I3.jpg
218,The Terminator,"In the post-apocalyptic future, reigning tyrannical supercomputers teleport a cyborg assassin known as the ""Terminator"" back to 1984 to kill Sarah Connor, whose unborn son is destined to lead insurgents against 21st century mechanical hegemony. Meanwhile, the human-resistance movement dispatches a lone warrior to safeguard Sarah. Can he stop the virtually indestructible killing machine?",7.684,1984-10-26,"['Action', 'Thriller', 'Science Fiction']",/qvktm0BHcnmDpul4Hz01GIazWPr.jpg
1317672,Love Me Love Me,"After her brother's death, June moves to Milan for a fresh start, finding comfort in Will, the perfect honor student at her new international school. But when his troubled best friend James—hiding a dangerous life in clandestine MMA fights—sparks a rivalry that quickly turns into irresistible attraction, June must choose between safety and a love that upends everything she thought she wanted.",5.978,2026-02-12,"['Romance', 'Drama']",/jfwHKRHRE2X4NTexdzblaioHH51.jpg
299710,Being 14,"The lives and turbulent adventures of a bunch of fourteen-year-old teenagers, through the eyes of three young girls - Sarah, Jade and Louise - with one last year to go before high school.",4.0,2015-02-25,['Drama'],/lQ1G742IaxqU6AHB3j6VQ2SN4GY.jpg
1368314,Passenger,"After a young couple witnesses a gruesome highway accident, they soon realize they did not leave the crash scene alone, as a demonic presence called the Passenger that won't stop until it claims them both turns their van life adventure into a nightmare.",6.2,2026-05-20,"['Horror', 'Thriller']",/2sOEJzhPzjTkZSlPbGxOJ7xgIyS.jpg
1300501,Patriot,"When a Malayali DRW analyst tries to expose a corrupt regional politician from Kerala and his malpractices regarding spyware, he goes on the run, becomes a vlogger, and must clear his name of the false allegations levelled against him.",7.1,2026-05-01,"['Action', 'Drama', 'Thriller']",/4cK4Js7yg8wL2YeZh7DWuoz1bgZ.jpg
1022787,Elio,"Elio, a space fanatic with an active imagination, finds himself on a cosmic misadventure where he must form new bonds with eccentric alien lifeforms, navigate a crisis of intergalactic proportions and somehow discover who he is truly meant to be.",6.913,2025-06-18,"['Adventure', 'Animation', 'Comedy', 'Family', 'Science Fiction']",/7z8jDiTZZco9moIKpTUImFtTy7o.jpg
1865,Pirates of the Caribbean: On Stranger Tides,"When Jack crosses paths with a woman from his past, he's not sure if it's love...or if she's a ruthless con artist using him to find the fabled Fountain of Youth.",6.57,2011-05-15,"['Adventure', 'Action', 'Fantasy']",/keGfSvCmYj7CvdRx36OdVrAEibE.jpg
1010755,The Strangers: Chapter 3,"Tethered by a frightening conclusion, Maya and the Strangers are locked on an unavoidable, unforgiving collision course — a showdown that proves they’re far from strangers now.",5.779,2026-02-05,"['Horror', 'Thriller']",/dWi4D1rUX1Pg4MaafpwwssqJ9lv.jpg
18240,The Proposal,"When she learns she's in danger of losing her visa status and being deported, overbearing book editor Margaret Tate forces her put-upon assistant, Andrew Paxton, to marry her.",7.168,2009-06-02,"['Comedy', 'Romance', 'Drama']",/6stnAm1wSek8ZrislwK4xGTyCnt.jpg
49013,Cars 2,Star race car Lightning McQueen and his pal Mater head overseas to compete in the World Grand Prix race. But the road to the championship becomes rocky as Mater gets caught up in an intriguing adventure of his own: international espionage.,6.182,2011-06-11,"['Animation', 'Family', 'Adventure', 'Comedy']",/okIz1HyxeVOMzYwwHUjH2pHi74I.jpg
1352874,The Crucifix: Blood of the Exorcist,"A gruesome discovery in the grounds of their new home plunges a young couple into a maelstrom of spiritual possession, pagan rituals, Viking battles, and violent revenge.",5.583,2025-01-09,['Horror'],/u3qOxvlykoTpurg1G8VOcawoePI.jpg
46079,Rusted Body,"A sexually insatiable woman leads a strange clan consisting of a sadistically unhinged woman, her oversexed boyfriend and a former army general. They have captured a businessman who has diverted company assets and work him over with torture and kinky sex to make him reveal the account number. Will he keep mum or will the clan get their way?",4.885,1987-06-20,"['Science Fiction', 'Horror']",/z92lpqlvMO7XeCdjr1meNYqk2bq.jpg
1191876,From the Ashes,"Jailed for her husband's crime, a woman discovers that her only way out is to solve riddles from her mysterious past.",0.0,2027-06-01,"['Drama', 'Crime', 'Mystery']",/aEUH2ECoZHvSmoMzJpca0STF2CZ.jpg
1368881,Ladies First,"An arrogant but charismatic ladies' man finds his life of money, power and casual flings upended when he wakes up in a parallel world dominated by women.",6.004,2026-05-21,"['Comedy', 'Fantasy']",/kjR56Yv17pbjTVBTMjqepvcus4f.jpg
186058,Lady Red Rose,Based on the novel by Oniroku Dan.,4.7,2006-05-27,['Drama'],/uPnm4hlqw1tUd14r1WGPSjKzoFo.jpg
293660,Deadpool,"The origin story of former Special Forces operative turned mercenary Wade Wilson, who, after being subjected to a rogue experiment that leaves him with accelerated healing powers, adopts the alter ego Deadpool. Armed with his new abilities and a dark, twisted sense of humor, Deadpool hunts down the man who nearly destroyed his life.",7.625,2016-02-09,"['Action', 'Adventure', 'Comedy']",/3E53WEZJqP6aM84D8CckXx4pIHw.jpg
10895,Pinocchio,"When the gentle woodcarver Geppetto builds a marionette to be his substitute son, a benevolent fairy brings the toy to life. The puppet, named Pinocchio, is not yet a human boy. He must earn the right to be real by proving that he is brave, truthful, and unselfish.",7.111,1940-02-23,"['Animation', 'Family', 'Fantasy']",/bnZJrLRnoQHpzEJdka1KYfsAF3N.jpg
62029,Bingo Bongo,"The ape-man, found somewhere in the jungles of Congo, transferred to Milan and named Bingo Bongo. The only one who believes in the human qualities of him is Laura, a woman anthropologist , so their affection for each other even grows to love.",5.707,1982-12-23,['Comedy'],/5ve4VuCwi7Xas5s50ynEB7uFjM2.jpg
1175942,The Bad Guys 2,"The now-reformed Bad Guys are trying (very, very hard) to be good, but instead find themselves hijacked into a high-stakes, globe-trotting heist, masterminded by a new team of criminals they never saw coming: The Bad Girls.",7.653,2025-07-24,"['Family', 'Comedy', 'Crime', 'Adventure', 'Animation']",/26oSPnq0ct59l07QOXZKyzsiRtN.jpg
793602,Favorite Concubine,"Jun-soo, a rich old man, decides to live in a local villa after retirement due to paralysis and health reasons. Only Jun-soo's wife, Hye-sook, and Joo-seok, will move to the provinces, and Hye-sook will only wait for the day Jun-soo dies. Jun-soo gradually becomes paralyzed, so he relies on a wheelchair, and Hye-sook meets up Joo-seok. However, Jun-soo suffered from paralysis that night. Unaware of this, Hye-sook and Joo-seok hire Jun-soo's caregiver to avoid Jun-soo and enjoy comfortably, but Joo-seok begins to look at the caregiver. After learning about the affair between Hye-sook and Joo-seok, Jun-soo begins to make a secret proposal to So-eun.",5.0,2020-12-24,['Drama'],/gGyQhfdqw9saOAlYHz4sxJO9Ot.jpg
1724,The Incredible Hulk,"Scientist Bruce Banner scours the planet for an antidote to the unbridled force of rage within him: the Hulk. But when the military masterminds who dream of exploiting his powers force him back to civilization, he finds himself coming face to face with a new, deadly foe.",6.243,2008-06-12,"['Science Fiction', 'Action', 'Adventure']",/gKzYx79y0AQTL4UAk1cBQJ3nvrm.jpg
1159831,The Bride!,A lonely Frankenstein travels to 1930s Chicago to ask groundbreaking scientist Dr. Euphronious to create a companion for him. The two revive a murdered young woman and The Bride is born. But what ensues is beyond what either of them imagined.,6.154,2026-03-04,"['Science Fiction', 'Horror', 'Fantasy']",/lV8YHwGkYZsm6EfIqnhaSz2avKt.jpg
228150,Fury,"April, 1945. As the Allies make their final push in the European Theatre, a battle-hardened army sergeant named Wardaddy commands a Sherman tank and her five-man crew on a deadly mission behind enemy lines. Outnumbered and outgunned, and with a rookie soldier thrust into their platoon, Wardaddy and his men face overwhelming odds in their heroic attempts to strike at the heart of Nazi Germany.",7.547,2014-10-15,"['War', 'Drama', 'Action']",/pfte7wdMobMF4CVHuOxyu6oqeeA.jpg
1701,Con Air,"Newly-paroled former US Army ranger Cameron Poe is headed back to his wife, but must fly home aboard a prison transport flight dubbed ""Jailbird"" taking the “worst of the worst” prisoners, a group described as “pure predators”, to a new super-prison. Poe faces impossible odds when the transport plane is skyjacked mid-flight by the most vicious criminals in the country led by the mastermind — genius serial killer Cyrus ""The Virus"" Grissom, and backed by black militant Diamond Dog and psychopath Billy Bedlam.",6.779,1997-06-05,"['Action', 'Thriller', 'Crime']",/kOKjgrEzGOP92rVQ6srA9jtp60l.jpg
296096,Me Before You,"Lou Clark, a directionless 26-year-old from the English countryside, takes a job at the local castle as a caregiver and companion to a wealthy young banker, Will Traynor. Wheelchair-bound from an accident two years prior, the once adventurous Will has all but given up — that is until Lou determines to show him that life is worth living.",7.923,2016-06-01,"['Drama', 'Romance']",/Ia3dzj5LnCj1ZBdlVeJrbKJQxG.jpg
11324,Shutter Island,"World War II soldier-turned-U.S. Marshal Teddy Daniels investigates the disappearance of a patient from a hospital for the criminally insane, but his efforts are compromised by troubling visions and a mysterious doctor.",8.198,2010-02-14,"['Drama', 'Thriller', 'Mystery']",/nrmXQ0zcZUL8jFLrakWc90IR8z9.jpg
822119,Captain America: Brave New World,"After meeting with newly elected U.S. President Thaddeus Ross, Sam finds himself in the middle of an international incident. He must discover the reason behind a nefarious global plot before the true mastermind has the entire world seeing red.",5.97,2025-02-12,"['Action', 'Thriller', 'Science Fiction']",/pzIddUEMWhWzfvLI3TwxUG2wGoi.jpg
754,Face/Off,"In order to foil a terrorist plot, an FBI agent undergoes facial transplant surgery and assumes the identity of a criminal mastermind. The plan turns sour when the criminal wakes up prematurely and seeks revenge.",7.058,1997-06-27,"['Action', 'Crime', 'Science Fiction']",/69Xzn8UdPbVnmqSChKz2RTpoNfB.jpg
1064028,Subservience,"With his wife out sick, a struggling father brings home a lifelike AI, only to have his self-aware new help want everything her new family has to offer... Like the affection of her owner and she'll kill to get it.",6.6,2024-08-15,"['Horror', 'Science Fiction', 'Thriller']",/gBenxR01Uy0Ev9RTIw6dVBPoyQU.jpg
986056,Thunderbolts*,"After finding themselves ensnared in a death trap, seven disillusioned castoffs must embark on a dangerous mission that will force them to confront the darkest corners of their pasts.",7.3,2025-04-30,"['Action', 'Science Fiction', 'Adventure']",/hqcexYHbiTBfDIdDWxrxPtVndBX.jpg
1637,Speed,Tensions run high when a crazed bomber rigs a Los Angeles bus with a device that will kill everyone on board if the vehicle's speed dips below fifty miles per hour.,7.156,1994-06-09,"['Action', 'Thriller']",/82PkCE4R95KhHICUDF7G4Ly2z3l.jpg
111,Scarface,"After getting a green card in exchange for assassinating a Cuban government official, Tony Montana stakes a claim on the drug trade in Miami. Viciously murdering anyone who stands in his way, Tony eventually becomes the biggest drug lord in the state, controlling nearly all the cocaine that comes through Miami. But increased pressure from the police, wars with Colombian drug cartels and his own drug-fueled paranoia serve to fuel the flames of his eventual downfall.",8.156,1983-12-09,"['Action', 'Crime', 'Drama']",/iQ5ztdjvteGeboxtmRdXEChJOHh.jpg
284053,Thor: Ragnarok,"Thor is imprisoned on the other side of the universe and finds himself in a race against time to get back to Asgard to stop Ragnarok, the destruction of his home-world and the end of Asgardian civilization, at the hands of a powerful new threat, the ruthless Hela.",7.581,2017-10-02,"['Action', 'Science Fiction', 'Comedy']",/rzRwTcFvttcN1ZpX2xv4j3tSdJu.jpg
278986,Gangor,"Sent to cover a story on the exploitation of tribal people, Upin meets a woman he believes is the epitome of Indian beauty. His pictures of her change both of their lives forever.",5.5,2011-01-01,['Drama'],/jf3Wa4ZIpHDhDkjUQ0PaUW7gyJM.jpg
19404,Dilwale Dulhania Le Jayenge,"Raj is a rich, carefree, happy-go-lucky second generation NRI. Simran is the daughter of Chaudhary Baldev Singh, who in spite of being an NRI is very strict about adherence to Indian values. Simran has left for India to be married to her childhood fiancé. Raj leaves for India with a mission at his hands, to claim his lady love under the noses of her whole family. Thus begins a saga.",8.51,1995-10-20,"['Comedy', 'Drama', 'Romance']",/tFbfCkS7q6g96wVoAu8kyr93iPm.jpg
49521,Man of Steel,"A young boy learns that he has extraordinary powers and is not of this earth. As a young man, he journeys to discover where he came from and what he was sent here to do. But the hero in him must emerge if he is to save the world from annihilation and become the symbol of hope for all mankind.",6.651,2013-06-12,"['Action', 'Adventure', 'Science Fiction']",/8GFtkImmK0K1VaUChR0n9O61CFU.jpg
508947,Turning Red,"Thirteen-year-old Mei is experiencing the awkwardness of being a teenager with a twist – when she gets too excited, she transforms into a giant red panda.",7.336,2022-03-10,"['Animation', 'Family', 'Comedy', 'Fantasy']",/qsdjk9oAKSQMWs0Vt5Pyfh6O4GZ.jpg
168259,Furious 7,Deckard Shaw seeks revenge against Dominic Toretto and his family for his comatose brother.,7.217,2015-04-01,"['Action', 'Crime', 'Thriller']",/ktofZ9Htrjiy0P6LEowsDaxd3Ri.jpg
508947,Turning Red,"Thirteen-year-old Mei is experiencing the awkwardness of being a teenager with a twist – when she gets too excited, she transforms into a giant red panda.",7.336,2022-03-10,"['Animation', 'Family', 'Comedy', 'Fantasy']",/qsdjk9oAKSQMWs0Vt5Pyfh6O4GZ.jpg
168259,Furious 7,Deckard Shaw seeks revenge against Dominic Toretto and his family for his comatose brother.,7.217,2015-04-01,"['Action', 'Crime', 'Thriller']",/ktofZ9Htrjiy0P6LEowsDaxd3Ri.jpg
38365,Grown Ups,"After their high school basketball coach passes away, five good friends and former teammates reunite for a Fourth of July holiday weekend.",6.423,2010-06-24,['Comedy'],/cQGM5k1NtU85n4TUlrOrwijSCcm.jpg
10192,Shrek Forever After,"A midlife-crisis burdened Shrek, longing for the days when he felt like a real ogre, makes a pact with magic deal-maker Rumpelstiltskin. But when he's duped and sent to a twisted version of Far Far Away—where Rumpelstiltskin is king, ogres are hunted, and he and Fiona have never met—he sets out to restore his world and reclaim his true love.",6.404,2010-05-20,"['Comedy', 'Adventure', 'Fantasy', 'Animation', 'Family']",/6HrfPZtKcGmX2tUWW3cnciZTaSD.jpg
530385,Midsommar,"Several friends travel to Sweden to study as anthropologists a summer festival that is held every ninety years in the remote hometown of one of them. What begins as a dream vacation in a place where the sun never sets, gradually turns into a dark nightmare as the mysterious inhabitants invite them to participate in their disturbing festive activities.",7.148,2019-07-03,"['Horror', 'Drama', 'Mystery']",/7LEI8ulZzO5gy9Ww2NVCrKmHeDZ.jpg
666277,Past Lives,"After decades apart, childhood friends Nora and Hae Sung are reunited in New York for one fateful weekend as they confront notions of destiny, love, and the choices that make a life.",7.7,2023-06-02,"['Drama', 'Romance']",/k3waqVXSnvCZWfJYNtdamTgTtTA.jpg
985939,Fall,"For best friends Becky and Hunter, life is all about conquering fears and pushing limits. But after they climb 2,000 feet to the top of a remote, abandoned radio tower, they find themselves stranded with no way down. Now Becky and Hunter's expert climbing skills will be put to the ultimate test as they desperately fight to survive the elements, a lack of supplies, and vertigo-inducing heights.",7.14,2022-08-11,['Thriller'],/spCAxD99U1A6jsiePFoqdEcY0dG.jpg
217,Indiana Jones and the Kingdom of the Crystal Skull,"Set during the Cold War, the Soviets—led by sword-wielding Irina Spalko—are in search of a crystal skull which has supernatural powers related to a mystical Lost City of Gold. Indy is coerced to head to Peru at the behest of a young man whose friend—and Indy's colleague—Professor Oxley has been captured for his knowledge of the skull's whereabouts.",6.025,2008-05-21,"['Adventure', 'Action']",/56As6XEM1flWvprX4LgkPl8ii4K.jpg
77,Memento,"Leonard Shelby is tracking down the man who raped and murdered his wife. The difficulty of locating his wife's killer, however, is compounded by the fact that he suffers from a rare, untreatable form of short-term memory loss. Although he can recall details of life before his accident, Leonard cannot remember what happened fifteen minutes ago, where he's going, or why.",8.176,2000-10-11,"['Mystery', 'Thriller']",/fKTPH2WvH8nHTXeBYBVhawtRqtR.jpg
419430,Get Out,"Chris and his girlfriend Rose go upstate to visit her parents for the weekend. At first, Chris reads the family's overly accommodating behavior as nervous attempts to deal with their daughter's interracial relationship, but as the weekend progresses, a series of increasingly disturbing discoveries lead him to a truth that he never could have imagined.",7.624,2017-02-24,"['Mystery', 'Thriller', 'Horror']",/mE24wUCfjK8AoBBjaMjho7Rczr7.jpg
278154,Ice Age: Collision Course,"Set after the events of Continental Drift, Scrat's epic pursuit of his elusive acorn catapults him outside of Earth, where he accidentally sets off a series of cosmic events that transform and threaten the planet. To save themselves from peril, Manny, Sid, Diego, and the rest of the herd leave their home and embark on a quest full of thrills and spills, highs and lows, laughter and adventure while traveling to exotic new lands and locations.",6.115,2016-06-23,"['Adventure', 'Animation', 'Family', 'Comedy', 'Science Fiction']",/okF78W1AcXAenlYFE3vna9Uuqjp.jpg
519465,Queen of Hearts,"Anne, a brilliant and dedicated advocacy lawyer specialising in society’s most vulnerable, children and young adults, lives what appears to be the picture-perfect life with her doctor-husband, Peter, and their twin daughters. When her estranged teenage stepson, Gustav, moves in with them, Anne’s escalating desire leads her down a dangerous rabbit hole which, once exposed, unleashes a sequence of events destined to destroy her world.",6.905,2019-03-27,['Drama'],/dfFVDIgovEfQZn53VRKLV2JQnRJ.jpg
447273,Snow White,"Following the benevolent King's disappearance, the Evil Queen dominated the once fair land with a cruel streak. Princess Snow White flees the castle when the Queen, in her jealousy over Snow White's inner beauty, tries to kill her. Deep into the dark woods, she stumbles upon seven magical dwarves and a young bandit named Jonathan. Together, they strive to survive the Queen's relentless pursuit and aspire to take back the kingdom.",4.307,2025-03-19,"['Family', 'Fantasy']",/oLxWocqheC8XbXbxqJ3x422j9PW.jpg
338953,Fantastic Beasts: The Secrets of Dumbledore,"Professor Albus Dumbledore knows the powerful, dark wizard Gellert Grindelwald is moving to seize control of the wizarding world. Unable to stop him alone, he entrusts magizoologist Newt Scamander to lead an intrepid team of wizards and witches. They soon encounter an array of old and new beasts as they clash with Grindelwald's growing legion of followers.",6.627,2022-04-06,"['Fantasy', 'Adventure']",/3c5GNLB4yRSLBby0trHoA1DSQxQ.jpg
858024,Hamnet,"The powerful story of love and loss that inspired the creation of Shakespeare's timeless masterpiece, Hamlet.",7.744,2025-11-26,"['Drama', 'Romance', 'History']",/zIcd6yuBucRNof5t9KVuGBHIhXU.jpg
637649,Wrath of Man,"A cold and mysterious new security guard for a Los Angeles cash truck company surprises his co-workers when he unleashes precision skills during a heist. The crew is left wondering who he is and where he came from. Soon, the marksman's ultimate motive becomes clear as he takes dramatic and irrevocable steps to settle a score.",7.575,2021-04-22,"['Thriller', 'Crime', 'Drama']",/M7SUK85sKjaStg4TKhlAVyGlz3.jpg
966,The Magnificent Seven,An oppressed Mexican peasant village hires seven gunfighters to help defend their homes.,7.507,1960-10-12,['Western'],/e5ToxOyJwuZD4VOfI0qEn5uIjeJ.jpg
861,Total Recall,"Construction worker Douglas Quaid's obsession with the planet Mars leads him to visit Rekall, a virtual vacation company that manufactures memories. When something goes wrong during Quaid's memory implant procedure, his life turns upside down, leading him to question what is reality and what isn't.",7.321,1990-06-01,"['Action', 'Adventure', 'Science Fiction']",/wVbeL6fkbTKSmNfalj4VoAUUqJv.jpg
44896,Rango,"When Rango, a lost family pet, accidentally winds up in the gritty, gun-slinging Western town of Dirt, the theater-loving lizard suddenly finds himself the newly appointed sheriff. Welcomed as the last hope the town has been waiting for, Rango is forced to play his new role to the hilt and uncover the truth behind a looming water crisis—before his act catches up with him.",6.905,2011-03-02,"['Animation', 'Comedy', 'Family', 'Western', 'Adventure']",/A5MP1guV8pbruieG0tnpPIbaJtt.jpg
630940,Jokyoshi Nikki 2 Abakareta Sei,"Mari is a high school teacher who is earnest and somewhat cold. Tired of her monotonous days, she discovered a secret game: wandering around Roppongi at night and seducing men. She enjoys the pleasure of lewd acts with strangers and finds temporary peace. Her student Toshihiko, who happens to witness her nighttime appearance, is captivated by Mari's seductive figure before he knows it...",9.3,1996-06-13,[],/rQSVn2kGbp15nQcbir2yLts0xqQ.jpg
508642,Gonjiam: Haunted Asylum,"The crew of a horror web series travels to an abandoned asylum for a live broadcast, but they encounter much more than expected as they move deeper inside the nightmarish old building.",7.271,2018-03-28,"['Horror', 'Mystery']",/fNqlsmu2tiI1bXcpU31yjHPkiJz.jpg
920,Cars,"Lightning McQueen, a hotshot rookie race car driven to succeed, discovers that life is about the journey, not the finish line, when he finds himself unexpectedly detoured in the sleepy Route 66 town of Radiator Springs. On route across the country to the big Piston Cup Championship in California to compete against two seasoned pros, McQueen gets to know the town's offbeat characters.",7.034,2006-06-08,"['Animation', 'Adventure', 'Comedy', 'Family']",/oloVyeBbkVGbFFaUjR8I7Boo7wA.jpg
9802,The Rock,"When vengeful General Francis X. Hummel seizes control of Alcatraz Island and threatens to launch missiles loaded with deadly chemical weapons into San Francisco, only a young FBI chemical weapons expert and notorious Federal prisoner have the skills to penetrate the impregnable island fortress and take him down.",7.152,1996-06-07,"['Action', 'Adventure', 'Thriller']",/eBcoxveWzzXQrCrwWMGAROcqgpP.jpg
